{
  "id": "01JZ7F3B8N9M2XKQ5R4T6VWY8A",
  "sender": {
    "address": "human:teacher@school.example",
    "kind": "human",
    "displayName": "Ms. Okafor",
    "userId": "user-1042"
  },
  "recipients": [
    {
      "address": "agent:flowforge-8c2f1a9d",
      "kind": "agent",
      "displayName": "Assessment Agent"
    }
  ],
  "conversationId": "01JZ7F3C4D5E6F7G8H9I0J1K2L",
  "workflowRef": "wf-run-42",
  "humanTaskId": "01JZ7F3D5E6F7G8H9I0J1K2L3M",
  "payload": {
    "body": "Please review the attached student work and approve or reject the assessment.",
    "format": "plaintext",
    "data": {
      "promptId": "prompt-7"
    }
  },
  "artifactRefs": [
    {
      "id": "01JZ7F3E6F7G8H9I0J1K2L3M4N",
      "hash": "sha256:9f86d081884c7d659a2feaa0c55ad015a3bf4f1b2b0b822cd15d6c15b0f00a08",
      "filename": "student-work.pdf",
      "mimeType": "application/pdf",
      "sizeBytes": 204800
    }
  ],
  "correlationTokens": {
    "flowforge-pending-task": "ff-pt-3f9a2c"
  },
  "createdAt": "2026-08-28T09:15:00Z",
  "updatedAt": "2026-08-28T09:15:00Z",
  "contentHash": "sha256:b1c2d3e4f5a6b7c8d9e0f1a2b3c4d5e6f7a8b9c0d1e2f3a4b5c6d7e8f9a0b1c2"
}
